{
  "scope": "hero",
  "viewports": [
    390
  ],
  "behavior_required": true,
  "files": [
    {
      "file": "dist/hero.html",
      "sha256": "0000000000000000000000000000000000000000000000000000000000000000",
      "bytes": 1234
    }
  ],
  "source_sha256": "0000000000000000000000000000000000000000000000000000000000000000",
  "html_file": "dist/hero.html",
  "html_sha256": "0000000000000000000000000000000000000000000000000000000000000000",
  "generated_at": "2026-07-05T12:00:00+02:00",
  "result": "pass"
}
